{"bpr_holdout":{"borough_level":{"Bronx":{"alpha":0.8854296948483765,"beta":1.0724281346859463,"test":{"n":168,"r2_vs_const":0.6579977713507381,"rmse":0.18141526460720891,"rmse_const_train_mean":0.31021254629010503,"rmse_freeflow_const":0.6315251104773728,"skill_vs_freeflow":0.9174786344170295},"train":{"n":168,"r2":0.6491064378733709,"rmse":0.17311058634446244}},"Brooklyn":{"alpha":0.7153930785463006,"beta":0.7964769615878532,"test":{"n":168,"r2_vs_const":0.47991009790595196,"rmse":0.18673186053129856,"rmse_const_train_mean":0.25892811729754633,"rmse_freeflow_const":0.5414905401484661,"skill_vs_freeflow":0.8810799451096045},"train":{"n":168,"r2":0.5023947140309275,"rmse":0.17523004808955522}},"Manhattan":{"alpha":1.5489527757542931,"beta":0.7699609482059843,"test":{"n":168,"r2_vs_const":0.6188899094146267,"rmse":0.36489391338543903,"rmse_const_train_mean":0.5910733728509919,"rmse_freeflow_const":1.228871110630797,"skill_vs_freeflow":0.9118300551379502},"train":{"n":168,"r2":0.624556824812704,"rmse":0.32317257463032284}},"Queens":{"alpha":0.6002884531939334,"beta":1.9828395240096814,"test":{"n":168,"r2_vs_const":0.5137673901616437,"rmse":0.18482522491133976,"rmse_const_train_mean":0.2650569537191776,"rmse_freeflow_const":0.46389396265143334,"skill_vs_freeflow":0.841260486172541},"train":{"n":168,"r2":0.553462889990334,"rmse":0.16612422191022164}},"Staten Island":{"alpha":0.4840098759221713,"beta":0.9658544703501983,"test":{"n":168,"r2_vs_const":0.7836274663655438,"rmse":0.074080872297165,"rmse_const_train_mean":0.15925938057047026,"rmse_freeflow_const":0.3384212293639917,"skill_vs_freeflow":0.9520821882039674},"train":{"n":168,"r2":0.7774749297747737,"rmse":0.06855523249408631}}},"zone_level":{"Bronx":{"alpha":0.8849616034386716,"beta":0.8432801441469324,"test":{"n":6814,"r2_vs_const":0.43713418224959966,"rmse":0.2620754926339171,"rmse_const_train_mean":0.3493204196537508,"rmse_freeflow_const":0.6656110680895081,"skill_vs_freeflow":0.8449714262155372},"train":{"n":6881,"r2":0.46092839829993226,"rmse":0.24208822813596764}},"Brooklyn":{"alpha":0.9481424008996763,"beta":0.48486576298686523,"test":{"n":9883,"r2_vs_const":0.16914101418858873,"rmse":0.46340704097169455,"rmse_const_train_mean":0.5083923039337874,"rmse_freeflow_const":0.859137774488599,"skill_vs_freeflow":0.7090625504616311},"train":{"n":9912,"r2":0.1616527166569488,"rmse":0.45376350079657324}},"Manhattan":{"alpha":1.4678224617487161,"beta":0.5262450250667287,"test":{"n":10686,"r2_vs_const":0.31821562969980766,"rmse":0.5859379782915732,"rmse_const_train_mean":0.709623726400223,"rmse_freeflow_const":1.2935592452643196,"skill_vs_freeflow":0.7948220681320934},"train":{"n":10739,"r2":0.30716357763420965,"rmse":0.530107956222409}},"Queens":{"alpha":0.774943951207509,"beta":0.7698469007272641,"test":{"n":10677,"r2_vs_const":0.37290590722641703,"rmse":0.25808010408154464,"rmse_const_train_mean":0.3259028589766573,"rmse_freeflow_const":0.6259166033225851,"skill_vs_freeflow":0.8299893583678056},"train":{"n":10740,"r2":0.3870727210072482,"rmse":0.23588645909268174}},"Staten Island":{"alpha":0.5920426151093093,"beta":0.6432751750986822,"test":{"n":2965,"r2_vs_const":0.41068042025636486,"rmse":0.1863335268775856,"rmse_const_train_mean":0.24272559202187635,"rmse_freeflow_const":0.47377475670530167,"skill_vs_freeflow":0.8453185715613549},"train":{"n":3021,"r2":0.3668814246254082,"rmse":0.1827561340478425}}}},"clustering":{"k":3,"n_excluded":5,"n_zones":256,"random_baseline":{"max":0.005997613001419123,"mean":-0.0475425829751301},"silhouette_by_k":{"3":0.33271161304346575,"4":0.3050103410337388,"5":0.24663162695586718,"6":0.17181535801209594,"7":0.19088874538041356,"8":0.16257422495737284},"stability":{"ari_mean":0.9659854651650643,"ari_min":0.8925743028941278,"n_seeds":10}},"ff_robustness":{"median_0205":{"Bronx":{"alpha":0.758095813606465,"beta":1.2750583648657245,"ff_mph":18.44454574584961,"r2":0.6444060714255879},"Brooklyn":{"alpha":0.5795827636884618,"beta":0.9342412085783164,"ff_mph":15.01839828491211,"r2":0.47540093055754185},"Manhattan":{"alpha":1.085566944853118,"beta":0.9762327813823596,"ff_mph":17.39630889892578,"r2":0.5943465408142166},"Queens":{"alpha":0.4930970592869746,"beta":2.5695535453563387,"ff_mph":18.87221336364746,"r2":0.5359845674880325},"Staten Island":{"alpha":0.4068505203978339,"beta":1.3173587823120383,"ff_mph":20.0361385345459,"r2":0.7842109808633114}},"p75_0005":{"Bronx":{"alpha":0.7782026262224822,"beta":1.2455426151762194,"ff_mph":18.658967971801758,"r2":0.6463489258158825},"Brooklyn":{"alpha":0.6317455779796735,"beta":0.876008015920457,"ff_mph":15.502301216125488,"r2":0.48506371649088054},"Manhattan":{"alpha":1.373924752743994,"beta":0.8427544438186733,"ff_mph":19.801002502441406,"r2":0.6161230203068175},"Queens":{"alpha":0.5916465397200928,"beta":2.0270148999540853,"ff_mph":20.21660041809082,"r2":0.5448325970652763},"Staten Island":{"alpha":0.4095391261913571,"beta":1.3051224364264777,"ff_mph":20.077442169189453,"r2":0.7846600555167426}},"p85_0205 (main)":{"Bronx":{"alpha":0.915163529959994,"beta":1.0772378485332275,"ff_mph":20.137920379638672,"r2":0.65441313432845},"Brooklyn":{"alpha":0.7495309413939854,"beta":0.7712335497363666,"ff_mph":16.608707427978516,"r2":0.5003835091418541},"Manhattan":{"alpha":1.555228620837717,"beta":0.7834022473075138,"ff_mph":21.32510757446289,"r2":0.6242469738584839},"Queens":{"alpha":0.5920211111389656,"beta":2.0252086843753254,"ff_mph":20.22186851501465,"r2":0.5448325500205404},"Staten Island":{"alpha":0.48566425363080223,"beta":1.0179512224125469,"ff_mph":21.2718448638916,"r2":0.78759939084645}},"p90_0105":{"Bronx":{"alpha":0.940501570178454,"beta":1.051461418634897,"ff_mph":20.414154052734375,"r2":0.6552099451347642},"Brooklyn":{"alpha":0.7559935087352592,"beta":0.7663631733270355,"ff_mph":16.66982650756836,"r2":0.5010320987415271},"Manhattan":{"alpha":1.6565570541174408,"beta":0.7559508219711869,"ff_mph":22.179208755493164,"r2":0.6276957459961382},"Queens":{"alpha":0.6012315606767937,"beta":1.9813684285450286,"ff_mph":20.351749420166016,"r2":0.5447746742209334},"Staten Island":{"alpha":0.49876762306153655,"beta":0.9791368327121845,"ff_mph":21.4800968170166,"r2":0.7869376132672554}}},"schema_version":"v1","tags":{"validation":"DERIVED"}}
